<?xml version="1.0" encoding="UTF-8" ?>
<extension type="package" version="3.0" xsi:noNamespaceSchemaLocation="./package.xsd" xmlns:xsi="http://www.w3.org/2001/XMLSchema-instance">
	<name>Everything Demonstration</name>
	<packagename>everything</packagename>
	<version>3.0.0</version>
	<url>http://www.joomla.org</url>
	<packager>Sam Moffatt</packager>
	<packagerurl>http://www.sammoffatt.com.au</packagerurl>
	<description>Joomla! Installer Sample and Test Package.</description>
	<update>http://update.joomla.org/update/packages/everything</update>
	
	<scriptfile>file.script.php</scriptfile> 
	
	<updateservers>
		<server type="extension" priority="1" name="Extension Update Site">http://jsitepoint.com/update/package/everything/extension.xml</server>
		<server type="collection" priority="2" name="Collection Update Site">http://jsitepoint.com/update/update.xml</server>
	</updateservers>
	
	<files folder="packages">
		<file type="library" 	id="lib_alpha" >lib_alpha.zip</file>
		<file type="component" 	id="com_alpha" >com_alpha.zip</file>
		<file type="module" 	id="mod_alpha" 	client="site">mod_alpha.zip</file>
		<file type="module"		id="mod_adminalpha" 	client="administrator">mod_alpha_admin.zip</file>
		<file type="plugin"		id="alpha"		group="system">plg_system_alpha.zip</file>
		<file type="template"	id="simple_template"	client="site">tpl_simple.zip</file>
		<file type="language"	id="xx-XX" client="site">lng_xx-XX.zip</file>
		<file type="language" 	id="xx-XX" client="administrator">lng_xx-XX_admin.zip</file>
	</files>
</extension>